{
  "$schema": "https://json-schema.org/draft/2020-12/schema",
  "$id": "https://pontual.local/schemas/places.schema.json",
  "title": "Pontual places gazetteer",
  "type": "array",
  "items": {
    "type": "object",
    "required": ["id", "name", "aliases", "lat", "lng"],
    "additionalProperties": false,
    "properties": {
      "id": { "type": "string", "pattern": "^[a-z0-9-]{2,40}$" },
      "name": { "type": "string", "minLength": 1 },
      "aliases": { "type": "array", "items": { "type": "string", "minLength": 1 } },
      "lat": { "type": "number", "minimum": -90, "maximum": 90 },
      "lng": { "type": "number", "minimum": -180, "maximum": 180 }
    }
  }
}